{
  "artifacts": {
    "analogy_report": "docs/task_workspaces/T-901/ANALOGY_REPORT.json",
    "contradiction_map": "docs/task_workspaces/T-901/CONTRADICTION_MAP.json",
    "discovery_gap_report": "docs/task_workspaces/T-901/DISCOVERY_GAP_REPORT.json",
    "discovery_map": "docs/task_workspaces/T-901/DISCOVERY_MAP.json",
    "experiment_simulation_report": "docs/task_workspaces/T-901/EXPERIMENT_SIMULATION_REPORT.json",
    "exploration_control_record": "docs/task_workspaces/T-901/EXPLORATION_CONTROL_RECORD.json",
    "feasibility_report": "docs/task_workspaces/T-901/FEASIBILITY_REPORT.json",
    "human_decision_record": "docs/task_workspaces/T-901/HUMAN_DECISION_RECORD.json",
    "hypothesis_packet": "docs/task_workspaces/T-901/HYPOTHESIS_PACKET.json",
    "idea_cluster_report": "docs/task_workspaces/T-901/IDEA_CLUSTER_REPORT.json",
    "novelty_report": "docs/task_workspaces/T-901/NOVELTY_REPORT.json",
    "opportunity_report": "docs/task_workspaces/T-901/OPPORTUNITY_REPORT.json",
    "research_ingestion_report": "docs/task_workspaces/T-901/RESEARCH_INGESTION_REPORT.json",
    "research_quality_report": "docs/task_workspaces/T-901/RESEARCH_QUALITY_REPORT.json",
    "research_synthesis_report": "docs/task_workspaces/T-901/RESEARCH_SYNTHESIS_REPORT.json",
    "solution_path_set": "docs/task_workspaces/T-901/SOLUTION_PATH_SET.json",
    "technology_frontier_model": "docs/task_workspaces/T-901/TECHNOLOGY_FRONTIER_MODEL.json"
  },
  "completed_at": "2026-03-13T12:21:22Z",
  "gcml_documents_loaded": 7,
  "hitl_requirements": [],
  "manifest_document_count": 507,
  "modifier": "AASAQ",
  "operator_constraints": [
    "Keep human approval mandatory"
  ],
  "orchestrator": "InventionPipelineManager",
  "recommended_next_actions": [
    "Review HUMAN_DECISION_RECORD.json",
    "Review EXPLORATION_CONTROL_RECORD.json",
    "Approve or redirect the next invention branch"
  ],
  "stage_records": [
    {
      "produced_artifacts": [
        "research_ingestion_report",
        "research_quality_report",
        "research_synthesis_report",
        "discovery_map",
        "technology_frontier_model"
      ],
      "stage": "knowledge_infrastructure",
      "status": "COMPLETED"
    },
    {
      "notes": [
        "Opportunity scanning runs before hypothesis generation because hypotheses are prioritized by evaluated opportunity zones."
      ],
      "produced_artifacts": [
        "discovery_gap_report",
        "opportunity_report",
        "analogy_report",
        "hypothesis_packet",
        "idea_cluster_report",
        "contradiction_map",
        "solution_path_set",
        "novelty_report",
        "feasibility_report",
        "experiment_simulation_report"
      ],
      "stage": "reasoning_and_evaluation",
      "status": "COMPLETED"
    },
    {
      "produced_artifacts": [
        "human_decision_record",
        "exploration_control_record"
      ],
      "stage": "human_guidance",
      "status": "PENDING_OPERATOR_ACTION"
    }
  ],
  "started_at": "2026-03-13T12:21:22Z",
  "status": "PENDING_HUMAN_REVIEW",
  "task_id": "T-901",
  "type": "WORKFLOW_RUN_RECORD",
  "workflow_id": "T-901-AASAQ-20260313T122122Z"
}
