{
  "artifacts": {
    "analogy_report": "docs/task_workspaces/T-270/ANALOGY_REPORT.json",
    "contradiction_map": "docs/task_workspaces/T-270/CONTRADICTION_MAP.json",
    "cross_industry_discovery_report": "docs/task_workspaces/T-270/CROSS_INDUSTRY_DISCOVERY_REPORT.json",
    "decision_ranking_report": "docs/task_workspaces/T-270/DECISION_RANKING_REPORT.json",
    "discovery_gap_report": "docs/task_workspaces/T-270/DISCOVERY_GAP_REPORT.json",
    "discovery_map": "docs/task_workspaces/T-270/DISCOVERY_MAP.json",
    "experiment_simulation_report": "docs/task_workspaces/T-270/EXPERIMENT_SIMULATION_REPORT.json",
    "exploration_control_record": "docs/task_workspaces/T-270/EXPLORATION_CONTROL_RECORD.json",
    "feasibility_report": "docs/task_workspaces/T-270/FEASIBILITY_REPORT.json",
    "human_decision_record": "docs/task_workspaces/T-270/HUMAN_DECISION_RECORD.json",
    "hypothesis_packet": "docs/task_workspaces/T-270/HYPOTHESIS_PACKET.json",
    "idea_cluster_report": "docs/task_workspaces/T-270/IDEA_CLUSTER_REPORT.json",
    "knowledge_distillation_report": "docs/task_workspaces/T-270/KNOWLEDGE_DISTILLATION_REPORT.json",
    "novelty_report": "docs/task_workspaces/T-270/NOVELTY_REPORT.json",
    "opportunity_report": "docs/task_workspaces/T-270/OPPORTUNITY_REPORT.json",
    "platform_alignment_report": "docs/task_workspaces/T-270/PLATFORM_ALIGNMENT_REPORT.json",
    "research_ingestion_report": "docs/task_workspaces/T-270/RESEARCH_INGESTION_REPORT.json",
    "research_program_report": "docs/task_workspaces/T-270/RESEARCH_PROGRAM_REPORT.json",
    "research_quality_report": "docs/task_workspaces/T-270/RESEARCH_QUALITY_REPORT.json",
    "research_strategy_report": "docs/task_workspaces/T-270/RESEARCH_STRATEGY_REPORT.json",
    "research_synthesis_report": "docs/task_workspaces/T-270/RESEARCH_SYNTHESIS_REPORT.json",
    "solution_path_set": "docs/task_workspaces/T-270/SOLUTION_PATH_SET.json",
    "technology_frontier_model": "docs/task_workspaces/T-270/TECHNOLOGY_FRONTIER_MODEL.json",
    "value_alignment_report": "docs/task_workspaces/T-270/VALUE_ALIGNMENT_REPORT.json"
  },
  "completed_at": "2026-03-13T19:49:11Z",
  "gcml_documents_loaded": 7,
  "hitl_requirements": [
    "PIVOT",
    "RESOURCE_INTENSIVE",
    "PATENT_RELATED"
  ],
  "manifest_document_count": 245,
  "modifier": "AASBT",
  "operator_constraints": [],
  "orchestrator": "InventionPipelineManager",
  "recommended_next_actions": [
    "Respond to the surfaced human review prompt",
    "Approve, pause, terminate, or redirect the active research program",
    "Use the exploration guidance to choose the next invention branch"
  ],
  "stage_records": [
    {
      "notes": [
        "Knowledge retrieval is routed through the AAS3 knowledge index.",
        "Discovery graph and planned program state were persisted to runtime state stores."
      ],
      "produced_artifacts": [
        "research_ingestion_report",
        "research_quality_report",
        "research_synthesis_report",
        "discovery_map",
        "cross_industry_discovery_report",
        "knowledge_distillation_report",
        "technology_frontier_model"
      ],
      "stage": "knowledge_infrastructure",
      "status": "COMPLETED"
    },
    {
      "notes": [
        "Cross-industry discovery and research-program planning run before hypothesis generation to keep exploration structured.",
        "Research director strategy now allocates branch budget after governed program updates.",
        "The governance kernel and durable graph/program stores are active in this stage."
      ],
      "produced_artifacts": [
        "discovery_gap_report",
        "opportunity_report",
        "analogy_report",
        "hypothesis_packet",
        "idea_cluster_report",
        "contradiction_map",
        "solution_path_set",
        "novelty_report",
        "feasibility_report",
        "value_alignment_report",
        "platform_alignment_report",
        "decision_ranking_report",
        "research_program_report",
        "research_strategy_report",
        "experiment_simulation_report"
      ],
      "stage": "reasoning_and_evaluation",
      "status": "COMPLETED"
    },
    {
      "notes": [
        "Operator review state was persisted through the AAS3 operator session manager."
      ],
      "produced_artifacts": [
        "human_decision_record",
        "exploration_control_record"
      ],
      "stage": "human_guidance",
      "status": "PENDING_OPERATOR_ACTION"
    }
  ],
  "started_at": "2026-03-13T19:49:10Z",
  "status": "PENDING_HUMAN_REVIEW",
  "task_id": "T-270",
  "type": "WORKFLOW_RUN_RECORD",
  "workflow_id": "T-270-AASBT-20260313T194910Z"
}
